{
  "schemaVersion": "1.0.0",
  "adapterVersion": "hevy-workouts-v1",
  "source": "hevy",
  "accountId": "account-1",
  "connectionGeneration": 1,
  "requestedRange": {
    "startLocalDate": "2026-10-02",
    "endLocalDate": "2026-11-01",
    "timezone": "America/New_York"
  },
  "fetchedAt": "2026-11-01T15:00:00Z",
  "completeness": "complete",
  "coverage": {
    "pagesRead": 1,
    "pageCount": 1,
    "countBefore": 4,
    "countAfter": 4,
    "itemCount": 4,
    "duplicatesRemoved": 0,
    "paginationComplete": true
  },
  "failures": [],
  "activities": [
    {
      "id": "hevy/395e5aeddb28bdd9269d423297176abb9da2f431500136af54920dbaf2193525",
      "kind": "workout",
      "startAt": "2026-10-30T22:00:00Z",
      "endAt": "2026-10-30T22:45:00Z",
      "duration": {
        "kind": "known",
        "seconds": 2700
      },
      "localStartDate": "2026-10-30",
      "revision": {
        "availability": "available",
        "providerUpdatedAt": "2026-10-30T23:00:00Z"
      },
      "fieldAvailability": {
        "location": "unsupported",
        "sourceTimezone": "unsupported"
      }
    },
    {
      "id": "hevy/f03444ad89b0b879542c671999a7502f4d203af781b351ac1438dc0915962388",
      "kind": "workout",
      "startAt": "2026-10-31T03:30:00Z",
      "endAt": "2026-10-31T04:30:00Z",
      "duration": {
        "kind": "known",
        "seconds": 3600
      },
      "localStartDate": "2026-10-30",
      "revision": {
        "availability": "unavailable",
        "providerUpdatedAt": null
      },
      "fieldAvailability": {
        "location": "unsupported",
        "sourceTimezone": "unsupported"
      }
    },
    {
      "id": "hevy/6681a824d8d36c2e82df2a3437db09b9ae164df45ac1c848708ada4354170f9e",
      "kind": "workout",
      "startAt": "2026-11-01T05:30:00Z",
      "endAt": "2026-11-01T06:30:00Z",
      "duration": {
        "kind": "known",
        "seconds": 3600
      },
      "localStartDate": "2026-11-01",
      "revision": {
        "availability": "available",
        "providerUpdatedAt": "2026-11-01T07:00:00Z"
      },
      "fieldAvailability": {
        "location": "unsupported",
        "sourceTimezone": "unsupported"
      }
    }
  ]
}
